{
  "packId": "ips.iran",
  "version": "1.0.0",
  "kind": "custom",
  "extends": { "packId": "iso", "version": "1.0.0" },
  "name": {
    "en": "IPS / Iranian Framework Pack",
    "fa": "بسته چارچوب ایران / استانداردهای IPS"
  },
  "description": {
    "en": "Iranian regulatory and contractual framework: IPS technical standards, General Conditions of Contract (Publication 4311), unit-rate schedules, price adjustment, HSE-MS, and NOC document coding. Extends the ISO pack and overlays the Iranian execution and payment model.",
    "fa": "چارچوب قانونی و قراردادی ایران: استانداردهای فنی IPS، شرایط عمومی پیمان نشریه ۴۳۱۱، فهرست‌بهای واحد پایه، تعدیل، نظام HSE-MS و کدگذاری مدارک شرکت‌های تابعه نفت. این بسته بر پایه بسته ایزو ساخته شده و مدل اجرا و پرداخت ایرانی را بر آن می‌افزاید."
  },
  "standardsReferences": [
    { "code": "IPS", "title": { "en": "Iranian Petroleum Standards", "fa": "استانداردهای نفت ایران" }, "scope": "Discipline engineering standards, document classes, review codes" },
    { "code": "نشریه ۴۳۱۱", "title": { "en": "General Conditions of Contract", "fa": "شرایط عمومی پیمان" }, "scope": "Contract lifecycle, payment, acceptance, warranty" },
    { "code": "فهرست‌بهای واحد پایه", "title": { "en": "Base Unit Price Schedules", "fa": "فهرست‌بهای واحد پایه" }, "scope": "Measurement and pricing basis" },
    { "code": "نظام فنی و اجرایی کشور", "title": { "en": "National Technical and Executive System", "fa": "نظام فنی و اجرایی کشور" }, "scope": "Gate model for state-funded projects" },
    { "code": "HSE-MS", "title": { "en": "Ministry of Petroleum HSE Management System", "fa": "نظام مدیریت بهداشت، ایمنی و محیط زیست وزارت نفت" }, "scope": "HSE structure and reporting" },
    { "code": "ISO 19650-2:2018", "title": { "en": "Information management", "fa": "مدیریت اطلاعات" }, "scope": "Inherited document control" }
  ],

  "terminology": {
    "workPackage": { "en": "Work Package", "fa": "بسته کاری" },
    "deliverable": { "en": "Deliverable Document", "fa": "مدرک تحویلی" },
    "deliverableRegister": { "en": "Master Document Register", "fa": "فهرست اصلی مدارک" },
    "breakdownPrimary": { "en": "Work Breakdown Structure", "fa": "ساختار شکست کار" },
    "areaUnit": { "en": "Unit / Area", "fa": "واحد / ناحیه" },
    "gate": { "en": "Stage Approval", "fa": "تصویب مرحله‌ای" },
    "progressBasis": { "en": "Physical Progress", "fa": "پیشرفت فیزیکی" },
    "owner": { "en": "Employer", "fa": "کارفرما" },
    "consultant": { "en": "Consulting Engineer", "fa": "مهندس مشاور" },
    "contractor": { "en": "Contractor", "fa": "پیمانکار" },
    "residentEngineer": { "en": "Resident Engineer", "fa": "ناظر مقیم" },
    "interimPayment": { "en": "Interim Payment Certificate", "fa": "صورت‌وضعیت موقت" },
    "finalPayment": { "en": "Final Payment Certificate", "fa": "صورت‌وضعیت قطعی" },
    "priceAdjustment": { "en": "Price Adjustment", "fa": "تعدیل" },
    "retention": { "en": "Retention / Performance Deduction", "fa": "حسن انجام کار" },
    "advancePayment": { "en": "Advance Payment", "fa": "پیش‌پرداخت" },
    "provisionalAcceptance": { "en": "Provisional Acceptance", "fa": "تحویل موقت" },
    "finalAcceptance": { "en": "Final Acceptance", "fa": "تحویل قطعی" },
    "warrantyPeriod": { "en": "Warranty Period", "fa": "دوره تضمین" },
    "siteMinutes": { "en": "Site Minutes", "fa": "صورتجلسه کارگاهی" },
    "unitRateSchedule": { "en": "Base Unit Price Schedule", "fa": "فهرست‌بهای واحد پایه" }
  },

  "breakdownStructures": [
    { "code": "WBS", "name": { "en": "Work Breakdown Structure", "fa": "ساختار شکست کار" }, "enabled": true, "mandatory": true, "maxDepth": 8, "codingRule": "num.wbs" },
    { "code": "CBS", "name": { "en": "Cost Breakdown Structure", "fa": "ساختار شکست هزینه" }, "enabled": true, "mandatory": true, "maxDepth": 6 },
    { "code": "OBS", "name": { "en": "Organizational Breakdown Structure", "fa": "ساختار شکست سازمانی" }, "enabled": true, "maxDepth": 5 },
    { "code": "SBS", "name": { "en": "System Breakdown Structure", "fa": "ساختار شکست سیستم" }, "enabled": true, "mandatory": true, "maxDepth": 3, "parentOf": ["TAG"] },
    { "code": "AREA", "name": { "en": "Unit / Area", "fa": "واحد / ناحیه" }, "enabled": true, "mandatory": true, "maxDepth": 4 },
    { "code": "PBS", "name": { "en": "Product Breakdown Structure", "fa": "ساختار شکست محصول" }, "enabled": true, "maxDepth": 6 },
    { "code": "TWP", "name": { "en": "Turnover Package", "fa": "بسته تحویل" }, "enabled": true, "maxDepth": 2 },
    { "code": "CWA", "name": { "en": "Construction Work Area", "fa": "محدوده کاری اجرا" }, "enabled": false },
    { "code": "CWP", "name": { "en": "Construction Work Package", "fa": "بسته کاری اجرا" }, "enabled": false },
    { "code": "IWP", "name": { "en": "Installation Work Package", "fa": "بسته کاری نصب" }, "enabled": false }
  ],

  "objectTypes": [
    {
      "type": "deliverable",
      "enabled": true,
      "lifecycle": "lc.ips.document",
      "numbering": "num.nioc.doc",
      "requiredAttributes": [
        { "field": "discipline_code", "requiredFromState": "WIP", "message": { "en": "Discipline is mandatory.", "fa": "دیسیپلین الزامی است." } },
        { "field": "ips_reference", "requiredFromState": "IFR", "message": { "en": "Applicable IPS standard reference is required.", "fa": "ارجاع به استاندارد IPS مربوطه الزامی است." } },
        { "field": "consultant_reviewer_id", "requiredFromState": "IFR", "message": { "en": "Assign the consulting engineer as reviewer.", "fa": "مهندس مشاور را به عنوان بازنگر تعیین کنید." } }
      ]
    },
    { "type": "interimPaymentCertificate", "enabled": true, "lifecycle": "lc.sooratvaziat", "numbering": "num.sooratvaziat" },
    { "type": "siteMinutes", "enabled": true, "numbering": "num.soorat.jalase" },
    { "type": "priceAdjustment", "enabled": true, "numbering": "num.tadil" },
    { "type": "tag", "enabled": true, "numbering": "num.tag" },
    { "type": "ncr", "enabled": true, "lifecycle": "lc.ncr", "numbering": "num.ncr" },
    { "type": "punchItem", "enabled": true, "lifecycle": "lc.punch" },
    { "type": "certificate", "enabled": true },
    { "type": "iwp", "enabled": false }
  ],

  "lifecycles": [
    {
      "id": "lc.ips.document",
      "appliesTo": ["deliverable", "vendorDocument"],
      "states": [
        { "code": "WIP", "name": { "en": "Work in Progress", "fa": "در حال تهیه" }, "category": "draft", "colour": "#94A3B8" },
        { "code": "IFR", "name": { "en": "Issued for Review (Consultant)", "fa": "ارسال برای بررسی مشاور" }, "category": "inReview", "colour": "#F59E0B" },
        { "code": "CODE2", "name": { "en": "Approved with Comments (Code 2)", "fa": "تأیید با اعمال نظرات (کد ۲)" }, "category": "inReview", "colour": "#FBBF24" },
        { "code": "CODE3", "name": { "en": "Revise and Resubmit (Code 3)", "fa": "اصلاح و ارسال مجدد (کد ۳)" }, "category": "draft", "colour": "#EF4444" },
        { "code": "IFA", "name": { "en": "Issued for Employer Approval", "fa": "ارسال برای تصویب کارفرما" }, "category": "inReview", "colour": "#F97316" },
        { "code": "CODE1", "name": { "en": "Approved (Code 1)", "fa": "تأیید شده (کد ۱)" }, "category": "approved", "colour": "#22C55E" },
        { "code": "IFC", "name": { "en": "Issued for Construction", "fa": "ابلاغ برای اجرا" }, "category": "issued", "colour": "#16A34A" },
        { "code": "AS_BUILT", "name": { "en": "As-Built", "fa": "چون‌ساخت" }, "category": "closed", "colour": "#0EA5E9" },
        { "code": "ARCHIVED", "name": { "en": "Archived", "fa": "بایگانی شده" }, "category": "closed", "colour": "#64748B", "isTerminal": true },
        { "code": "SUPERSEDED", "name": { "en": "Superseded", "fa": "منسوخ شده" }, "category": "cancelled", "colour": "#DC2626", "isTerminal": true }
      ],
      "transitions": [
        { "from": "WIP", "to": "IFR", "capability": "document.share", "allowedCompanyTypes": ["EPC", "SUB", "VEN"], "guards": [{ "check": "interDisciplineCheckComplete", "message": { "en": "Inter-discipline check must be signed off.", "fa": "کنترل بین‌دیسیپلینی باید تأیید شده باشد." } }, { "check": "ipsReferenceProvided", "message": { "en": "Applicable IPS standard must be referenced.", "fa": "استاندارد IPS مربوطه باید ارجاع داده شود." } }], "slaHours": 24, "emitsEvent": "document.shared.v1" },
        { "from": "IFR", "to": "CODE2", "capability": "document.review.code", "allowedCompanyTypes": ["PMC"], "slaHours": 336, "escalateAfterHours": 240 },
        { "from": "IFR", "to": "CODE3", "capability": "document.review.code", "allowedCompanyTypes": ["PMC"], "slaHours": 336, "emitsEvent": "document.rejected.v1" },
        { "from": "IFR", "to": "IFA", "capability": "document.submit.approval", "allowedCompanyTypes": ["PMC"], "slaHours": 336 },
        { "from": "CODE3", "to": "IFR", "capability": "document.share", "allowedCompanyTypes": ["EPC", "SUB", "VEN"] },
        { "from": "CODE2", "to": "IFA", "capability": "document.submit.approval", "allowedCompanyTypes": ["EPC", "PMC"], "guards": [{ "check": "reviewCommentsDispositioned", "message": { "en": "All consultant comments must be applied and dispositioned.", "fa": "همه نظرات مشاور باید اعمال و تعیین تکلیف شوند." } }] },
        { "from": "IFA", "to": "CODE1", "capability": "document.approve", "allowedCompanyTypes": ["OWN"], "slaHours": 504, "escalateAfterHours": 336, "signatureRequired": "advanced", "emitsEvent": "document.approved.v1" },
        { "from": "IFA", "to": "CODE3", "capability": "document.reject", "allowedCompanyTypes": ["OWN"], "emitsEvent": "document.rejected.v1" },
        { "from": "CODE1", "to": "IFC", "capability": "document.publish", "allowedCompanyTypes": ["OWN", "PMC"], "signatureRequired": "advanced", "emitsEvent": "document.published.v1" },
        { "from": "IFC", "to": "AS_BUILT", "capability": "document.asbuilt", "allowedCompanyTypes": ["EPC"], "guards": [{ "check": "redlinesConsolidated", "message": { "en": "Field red-lines must be consolidated.", "fa": "اصلاحات کارگاهی باید تجمیع شوند." } }] },